{
  "schema": "dreamco.data_package_asset_provenance.v1",
  "asset_id": "edu-vp-01.8109",
  "title": "Study plan: Veterinary Physiology (CIP 01.8109)",
  "evidence_id": "edu-career-pathways-01.8109-onet31.0-2026-10-02",
  "capability_id": "career-pathway-study-plan",
  "source_type": "onet",
  "source_reference": "https://www.onetcenter.org/dl_files/database/db_31_0_csv/",
  "retrieved_at": "2026-10-02",
  "content_version": "O*NET 31.0 (db_31_0_csv); CIP 2020 to O*NET-SOC 2019 crosswalk",
  "license_or_usage_basis": "CC BY 4.0 for the O*NET 31.0 Database and O*NET Crosswalk Files (USDOL/ETA), which allows commercial use and redistribution with attribution; the outline, next steps, and practice prompts are DreamCo-original synthesis (owner approval for sale pending)",
  "transformation": "derived_metric",
  "evaluator_version": "edu-career-pathways build.py sha256:0e5a0d40bce913e6b56eb3b8424e006e70eb867c0cbd28cc9d2ade579c6abc7e",
  "integrity_hash": "sha256:7e32b0a13334d74bf03a32c603d3dfd2ad19a8e7291d450f9e38712e30d14fb7",
  "ownership_class": "open_license_with_conditions",
  "creator": "DreamCo (Grok-Edu-Career-Pathways, build.py)",
  "owner": "Mixed: O*NET-derived values, occupation titles, Job Zone names/descriptions, and task IDs are USDOL/ETA content under CC BY 4.0; the outline, next-steps wording, and practice prompts/rubrics are DreamCo-original",
  "asset_files": [
    {
      "path": "study_plans/01.8109_veterinary_physiology.md",
      "sha256": "7e32b0a13334d74bf03a32c603d3dfd2ad19a8e7291d450f9e38712e30d14fb7",
      "bytes": 13883
    },
    {
      "path": "study_plans/01.8109_veterinary_physiology/plan.json",
      "sha256": "fb1d727df74c9748aaf2dabf4ca85f42f3ff3014279306a7ee9dd2a2abf462ef",
      "bytes": 17252
    }
  ],
  "sources": [
    {
      "source_id": "onet_db_31_0",
      "title": "O*NET 31.0 Database (CSV): occupations, knowledge, essential skills",
      "publisher": "U.S. Department of Labor, Employment and Training Administration (USDOL/ETA)",
      "url": "https://www.onetcenter.org/dl_files/database/db_31_0_csv/",
      "version": "31.0",
      "files": [
        {
          "name": "occupation_data.csv",
          "url": "https://www.onetcenter.org/dl_files/database/db_31_0_csv/occupation_data.csv",
          "sha256": "a09eae1d6609686e44e05b7290993a1c8b523d8ca224bc0eedc194c855c3ee02"
        },
        {
          "name": "knowledge.csv",
          "url": "https://www.onetcenter.org/dl_files/database/db_31_0_csv/knowledge.csv",
          "sha256": "88092e17d16096cdebe292fee4389deb460edda24ae8b4637212c69c71562f55"
        },
        {
          "name": "essential_skills.csv",
          "url": "https://www.onetcenter.org/dl_files/database/db_31_0_csv/essential_skills.csv",
          "sha256": "68c4d31d8c55077238395dca40cc4e6d32e6a608b5474bb8264b1f98ae415bd7"
        }
      ],
      "retrieved_at": "2026-09-28",
      "license": "CC BY 4.0",
      "license_url": "https://creativecommons.org/licenses/by/4.0/",
      "ownership_class": "open_license_with_conditions",
      "commercial_use_allowed": true,
      "redistribution_allowed": true,
      "ai_training_allowed": true,
      "attribution_required": true,
      "share_alike_required": false,
      "required_notices": [
        "This page includes information from the O*NET 31.0 Database by the U.S. Department of Labor, Employment and Training Administration (USDOL/ETA). Used under the CC BY 4.0 license.",
        "O*NET® is a trademark of USDOL/ETA.",
        "DreamCo has modified all or some of this information. USDOL/ETA has not approved, endorsed, or tested these modifications."
      ],
      "restrictions": [
        "Use 'O*NET' only as an adjective; do not imply USDOL/ETA endorsement."
      ]
    },
    {
      "source_id": "onet_db_31_0_jobzones_tasks",
      "title": "O*NET 31.0 Database (CSV): job zones, job zone reference, task statements",
      "publisher": "U.S. Department of Labor, Employment and Training Administration (USDOL/ETA)",
      "url": "https://www.onetcenter.org/dl_files/database/db_31_0_csv/",
      "version": "31.0",
      "files": [
        {
          "name": "job_zones.csv",
          "url": "https://www.onetcenter.org/dl_files/database/db_31_0_csv/job_zones.csv",
          "sha256": "093f01891ac2e602a8cc6c859ecb619b5bc00eb50cd3f3c1134c05b704481944"
        },
        {
          "name": "job_zone_reference.csv",
          "url": "https://www.onetcenter.org/dl_files/database/db_31_0_csv/job_zone_reference.csv",
          "sha256": "75e21c0bbe0ec4d70428863b6930fbff0e279537faba1e630d7f2105ba2b6038"
        },
        {
          "name": "task_statements.csv",
          "url": "https://www.onetcenter.org/dl_files/database/db_31_0_csv/task_statements.csv",
          "sha256": "4568e14d8db6f05551ad37e056e909b13ebae4a26bcb5ff915bb5f281d582c57"
        }
      ],
      "retrieved_at": "2026-10-02",
      "license": "CC BY 4.0",
      "license_url": "https://creativecommons.org/licenses/by/4.0/",
      "ownership_class": "open_license_with_conditions",
      "commercial_use_allowed": true,
      "redistribution_allowed": true,
      "ai_training_allowed": true,
      "attribution_required": true,
      "share_alike_required": false,
      "required_notices": [
        "This page includes information from the O*NET 31.0 Database by the U.S. Department of Labor, Employment and Training Administration (USDOL/ETA). Used under the CC BY 4.0 license.",
        "O*NET® is a trademark of USDOL/ETA.",
        "DreamCo has modified all or some of this information. USDOL/ETA has not approved, endorsed, or tested these modifications."
      ],
      "restrictions": [
        "Use 'O*NET' only as an adjective; do not imply USDOL/ETA endorsement.",
        "Generated tier: task statements are quoted verbatim with attribution and are not relabeled as DreamCo-owned."
      ]
    },
    {
      "source_id": "onet_cip_soc_crosswalk",
      "title": "CIP 2020 to O*NET-SOC 2019 crosswalk (Education_CIP_to_ONET_SOC.xlsx)",
      "publisher": "U.S. Department of Labor, Employment and Training Administration (USDOL/ETA); O*NET Resource Center Crosswalk Files, based on NCES CIP 2020",
      "url": "https://www.onetcenter.org/crosswalks/cip/Education_CIP_to_ONET_SOC.xlsx",
      "version": "CIP 2020 to O*NET-SOC 2019 (sha256-pinned; the file states no revision date)",
      "sha256": "4802101afb1dfa83acde5d125bc55170410686c6d379a8d893c74447361ea6e8",
      "retrieved_at": "2026-09-28",
      "license": "CC BY 4.0",
      "license_url": "https://creativecommons.org/licenses/by/4.0/",
      "ownership_class": "open_license_with_conditions",
      "commercial_use_allowed": true,
      "redistribution_allowed": true,
      "ai_training_allowed": true,
      "attribution_required": true,
      "share_alike_required": false,
      "required_notices": [
        "Crosswalk Files by USDOL/ETA, licensed under CC BY 4.0."
      ],
      "restrictions": []
    }
  ],
  "derived_components": [
    {
      "component": "linked_occupations",
      "ownership_class": "open_license_with_conditions",
      "derivation_type": "structured_extraction",
      "description": "3 O*NET-SOC codes/titles linked to CIP 01.8109 in the crosswalk, filtered to codes in O*NET 31.0 occupation_data.csv, with each code's O*NET 31.0 Job Zone.",
      "derived_from": [
        "onet_cip_soc_crosswalk",
        "onet_db_31_0",
        "onet_db_31_0_jobzones_tasks"
      ]
    },
    {
      "component": "knowledge_and_skill_importance",
      "ownership_class": "open_license_with_conditions",
      "derivation_type": "derived_metric",
      "description": "Top-8 knowledge and top-6 Essential Skills by unweighted mean O*NET 31.0 importance (Scale IM) across linked occupations.",
      "derived_from": [
        "onet_db_31_0"
      ]
    },
    {
      "component": "entry_targets",
      "ownership_class": "open_license_with_conditions",
      "derivation_type": "derived_metric",
      "description": "2 entry target(s) chosen by a DreamCo rule: Job Zone 4 first (fallback 3, 5, 1-2), excluding Manager/Chief/Postsecondary/All Other/Supervisor/Director titles, base .00 codes first, then ranked by Pearson correlation of knowledge-importance profiles; generated tier: the rule output is used without manual review.",
      "derived_from": [
        "onet_db_31_0",
        "onet_db_31_0_jobzones_tasks",
        "linked_occupations"
      ]
    },
    {
      "component": "four_year_outline",
      "ownership_class": "synthetic_generated_by_dreamco",
      "derivation_type": "synthetic_data",
      "description": "Generated tier: DreamCo template that lists this major's top O*NET knowledge and Essential Skill element names by year; no per-major course mapping and no review.",
      "derived_from": [
        "knowledge_and_skill_importance",
        "entry_targets"
      ]
    },
    {
      "component": "typical_next_steps",
      "ownership_class": "synthetic_generated_by_dreamco",
      "derivation_type": "synthetic_data",
      "description": "DreamCo-original synthesis summarizing linked occupations by Job Zone; cites O*NET 31.0 Job Zone numbers only and does not quote O*NET Job Zone names or descriptions.",
      "derived_from": [
        "linked_occupations",
        "onet_db_31_0_jobzones_tasks"
      ]
    },
    {
      "component": "practice_tasks",
      "ownership_class": "synthetic_generated_by_dreamco",
      "derivation_type": "synthetic_data",
      "description": "Generated tier: 6 DreamCo template exercises, each quoting one O*NET 31.0 task statement verbatim with attribution (USDOL/ETA, CC BY 4.0; the quote is O*NET content) and adding a fixed template prompt, 3-criterion rubric and reference outline. Authorship: DreamCo-generated by build.py from a fixed template (tier 'generated'); not individually authored, not reviewed by a human or by an AI author.",
      "derived_from": [
        "onet_db_31_0_jobzones_tasks",
        "entry_targets"
      ]